{
  "schema_version": "1.0",
  "export_id": "export-share-001",
  "project_id": "project-demo-001",
  "revision_id": "rev-001",
  "created_at": "2026-09-04T13:00:00Z",
  "output": {
    "path": "exports/product-tutorial-share.mp4",
    "sha256": "ffffffffffffffffffffffffffffffffffffffffffffffffffffffffffffffff",
    "size_bytes": 48000000,
    "duration_us": 60100000
  },
  "profile": {
    "container": "mp4",
    "video_codec": "h264",
    "audio_codec": "aac",
    "width": 2560,
    "height": 1440,
    "frame_rate": {
      "numerator": 60,
      "denominator": 1
    },
    "caption_sidecar": true,
    "video_pixel_format": "yuv420p",
    "audio_sample_format": "fltp"
  },
  "source_hashes": [
    "aaaaaaaaaaaaaaaaaaaaaaaaaaaaaaaaaaaaaaaaaaaaaaaaaaaaaaaaaaaaaaaa",
    "1111111111111111111111111111111111111111111111111111111111111111"
  ],
  "timeline_sha256": "2222222222222222222222222222222222222222222222222222222222222222",
  "qa_report_sha256": "3333333333333333333333333333333333333333333333333333333333333333",
  "decode_verified": true,
  "warnings": [
    "Explicit compressed sharing profile. Not a lossless master."
  ],
  "quality_policy": {
    "mode": "compressed_share",
    "user_selected_lower_quality": true,
    "uses_preview_source": false
  },
  "lossless_verification": {
    "required": false,
    "video_samples_equal": null,
    "audio_samples_equal": null,
    "reference_boundary": "not_applicable"
  }
}
